{
  "schema_version": "1.0",
  "evaluation_id": "eval_A000290_8_42",
  "created_at": "2026-09-05T01:54:37.176514+00:00",
  "protocol": {
    "schema_version": "1.0",
    "protocol_id": "sha256:8394941a28daa4bc80caee74d34fd4d061e6cc881ee23bf9d6015c54309ca35c",
    "checkpoint_sha256": "sha256:75419e4d973e285b964999a584c1663be93703e43ea168472b12b3b5d57330d5",
    "benchmark_manifest_sha256": "sha256:eb2a1ed1bfaf72933961cea1f86065744cf54430623b3b006247eb866264b172",
    "observed_horizon": 20,
    "unseen_horizon": 100,
    "candidate_budget": 8,
    "base_seed": 42,
    "temperature": 0.8,
    "top_p": 0.95,
    "max_tokens": 128,
    "constant_resolution": true,
    "solver_timeout_ms": 250,
    "max_placeholders": 4,
    "fuel_per_invocation": 10000,
    "memory_limit_mib": 16,
    "mdl_ratio_max": 1.2,
    "native_evaluator_required": true,
    "code_revision": "trustworthy-v1",
    "environment_fingerprint": "sha256:0000000000000000000000000000000000000000000000000000000000000000"
  },
  "checkpoint": {
    "format_version": "2.0",
    "checkpoint_sha256": "sha256:75419e4d973e285b964999a584c1663be93703e43ea168472b12b3b5d57330d5",
    "producer_version": "oeis-learn-0.1.0",
    "epoch": 60,
    "precision": "fp32",
    "encoder_config": {
      "d_model": 256,
      "n_heads": 4,
      "n_encoder_layers": 4,
      "d_ff": 1024,
      "dropout": 0.1,
      "primes": [
        3,
        5,
        7,
        11,
        13,
        17,
        19,
        23,
        29,
        31,
        37,
        41,
        43,
        47,
        53,
        59
      ],
      "max_valuation": 32,
      "use_film": true
    },
    "decoder_config": {
      "d_model": 256,
      "n_heads": 4,
      "n_decoder_layers": 4,
      "d_ff": 1024,
      "dropout": 0.1
    },
    "vocabulary_sha256": "sha256:90b0c66159d86a66e773e8bb70ab57380687b8714b5b6abb6bcf30f19ba6785a",
    "source_checkpoint_sha256": "sha256:7562d7412dbd9095e4f4198f12070ad520f6a7abdbb55e909ec98132bd0a6067",
    "runtime_environment": {
      "python_version": "3.12.3",
      "torch_version": "2.13.0+cpu",
      "platform": "Linux-6.8.0-52-lowlatency-x86_64-with-glibc2.39",
      "processor": "x86_64"
    }
  },
  "target": {
    "cohort_id": "trustworthy_synthesis_v1",
    "oeis_id": "A000290",
    "offset": 0,
    "terms_sha256": "sha256:effe0e3d0c929e9aecedf1befab2c09aa3fcca86108a59add27b0b4ff845aa8e",
    "result_profile": "i64_scalar_v1"
  },
  "candidates": [
    {
      "candidate_id": "eval_A000290_8_42_c0",
      "candidate_index": 0,
      "candidate_seed": -4238313364619665429,
      "raw_token_ids": [
        1,
        4,
        6,
        4,
        7,
        4,
        8,
        9,
        5,
        4,
        11,
        76,
        14,
        5,
        4,
        12,
        15,
        5,
        4,
        13,
        87,
        15,
        5,
        4,
        13,
        84,
        15,
        5,
        16,
        76,
        64,
        16,
        76,
        64,
        24,
        20,
        92,
        17,
        84,
        16,
        76,
        64,
        20,
        93,
        22,
        17,
        84,
        68,
        20,
        92,
        17,
        84,
        20,
        92,
        19,
        92,
        19,
        92,
        65,
        65,
        65,
        65,
        20,
        92,
        65,
        20,
        92,
        65,
        20,
        92,
        65,
        20,
        92,
        65,
        20,
        92,
        65,
        20,
        92,
        5,
        5
      ],
      "raw_wat": "( module ( func ( export \"compute\" ) ( param $n i32 ) ( result i64 ) ( local $n64 i64 ) ( local $temp i64 ) local.get $n i64.extend_i32_u local.get $n i64.extend_i32_u i64.mul i64.const 0 local.set $temp local.get $n i64.extend_i32_u i64.const 1 i64.add local.set $temp return i64.const 0 local.set $temp i64.const 0 i32.const 0 i32.const 0 drop drop drop drop i64.const 0 drop i64.const 0 drop i64.const 0 drop i64.const 0 drop i64.const 0 drop i64.const 0 ) )",
      "resolved_wat": "( module ( func ( export \"compute\" ) ( param $n i32 ) ( result i64 ) ( local $n64 i64 ) ( local $temp i64 ) local.get $n i64.extend_i32_u local.get $n i64.extend_i32_u i64.mul i64.const 0 local.set $temp local.get $n i64.extend_i32_u i64.const 1 i64.add local.set $temp return i64.const 0 local.set $temp i64.const 0 i32.const 0 i32.const 0 drop drop drop drop i64.const 0 drop i64.const 0 drop i64.const 0 drop i64.const 0 drop i64.const 0 drop i64.const 0 ) )",
      "resolved_constants": [],
      "canonical_wat": "( module ( func ( export \"compute\" ) ( param $n i32 ) ( result i64 ) local.get $n i64.extend_i32_u local.get $n i64.extend_i32_u i64.mul local.get $n i64.extend_i32_u i64.const 1 i64.add drop return i64.const 0 i32.const 0 i32.const 0 drop drop drop drop i64.const 0 ) )",
      "canonical_sha256": "sha256:000c0d32f059c7c867d2b682a88a14e264027066b0ec40a8e0cdf65412b1b579",
      "duplicate_of": null,
      "stage_records": [
        {
          "stage": "GENERATION",
          "status": "PASSED",
          "duration_ms": 0.0016890116967260838,
          "reason_code": null,
          "message": null,
          "evidence": {}
        },
        {
          "stage": "CONSTANT_RESOLUTION",
          "status": "NOT_REQUIRED",
          "duration_ms": 0.0,
          "reason_code": null,
          "message": null,
          "evidence": {}
        },
        {
          "stage": "CANONICALIZATION",
          "status": "PASSED",
          "duration_ms": 1.89513701479882,
          "reason_code": null,
          "message": null,
          "evidence": {
            "canonical_sha256": "sha256:000c0d32f059c7c867d2b682a88a14e264027066b0ec40a8e0cdf65412b1b579",
            "waste_ratio": 0.425
          }
        },
        {
          "stage": "ASSEMBLY",
          "status": "PASSED",
          "duration_ms": 32.69569098483771,
          "reason_code": null,
          "message": null,
          "evidence": {
            "byte_size": 81
          }
        },
        {
          "stage": "EXECUTION",
          "status": "PASSED",
          "duration_ms": 9.259026031941175,
          "reason_code": null,
          "message": null,
          "evidence": {
            "max_fuel": 10,
            "total_fuel": 1200,
            "output_count": 120
          }
        },
        {
          "stage": "OBSERVED_MATCH",
          "status": "PASSED",
          "duration_ms": 0.011303985957056284,
          "reason_code": null,
          "message": null,
          "evidence": {}
        },
        {
          "stage": "EXTRAPOLATION",
          "status": "PASSED",
          "duration_ms": 0.019692990463227034,
          "reason_code": null,
          "message": null,
          "evidence": {}
        },
        {
          "stage": "COMPACTNESS",
          "status": "PASSED",
          "duration_ms": 0.1967849675565958,
          "reason_code": null,
          "message": null,
          "evidence": {
            "mdl_ratio": 0.3068181818181818,
            "byte_size": 81
          }
        }
      ],
      "outputs": [
        "0",
        "1",
        "4",
        "9",
        "16",
        "25",
        "36",
        "49",
        "64",
        "81",
        "100",
        "121",
        "144",
        "169",
        "196",
        "225",
        "256",
        "289",
        "324",
        "361",
        "400",
        "441",
        "484",
        "529",
        "576",
        "625",
        "676",
        "729",
        "784",
        "841",
        "900",
        "961",
        "1024",
        "1089",
        "1156",
        "1225",
        "1296",
        "1369",
        "1444",
        "1521",
        "1600",
        "1681",
        "1764",
        "1849",
        "1936",
        "2025",
        "2116",
        "2209",
        "2304",
        "2401",
        "2500",
        "2601",
        "2704",
        "2809",
        "2916",
        "3025",
        "3136",
        "3249",
        "3364",
        "3481",
        "3600",
        "3721",
        "3844",
        "3969",
        "4096",
        "4225",
        "4356",
        "4489",
        "4624",
        "4761",
        "4900",
        "5041",
        "5184",
        "5329",
        "5476",
        "5625",
        "5776",
        "5929",
        "6084",
        "6241",
        "6400",
        "6561",
        "6724",
        "6889",
        "7056",
        "7225",
        "7396",
        "7569",
        "7744",
        "7921",
        "8100",
        "8281",
        "8464",
        "8649",
        "8836",
        "9025",
        "9216",
        "9409",
        "9604",
        "9801",
        "10000",
        "10201",
        "10404",
        "10609",
        "10816",
        "11025",
        "11236",
        "11449",
        "11664",
        "11881",
        "12100",
        "12321",
        "12544",
        "12769",
        "12996",
        "13225",
        "13456",
        "13689",
        "13924",
        "14161"
      ],
      "max_fuel": 10,
      "total_fuel": 1200,
      "peak_memory_mib": 1.0,
      "first_observed_divergence": null,
      "first_unseen_divergence": null,
      "byte_size": 81,
      "mdl_ratio": 0.3068181818181818,
      "classification": "EXTRAPOLATING_SUCCESS",
      "primary_failure_stage": null,
      "secondary_diagnostics": []
    },
    {
      "candidate_id": "eval_A000290_8_42_c1",
      "candidate_index": 1,
      "candidate_seed": 4285731082533383587,
      "raw_token_ids": [
        1,
        4,
        6,
        4,
        7,
        4,
        8,
        9,
        5,
        4,
        11,
        76,
        14,
        5,
        4,
        12,
        15,
        5,
        4,
        13,
        87,
        15,
        5,
        4,
        13,
        84,
        15,
        5,
        16,
        76,
        64,
        16,
        76,
        64,
        24,
        20,
        92,
        17,
        84,